{"spec_path":"tools/fixtures/spec/direct-bypass-confirmed.json","spec_version":1,"spec_sha256":"e6a4f5069ffb38df8a7badeaf7e1a3030d003081b07eacf19a0c29b62b530288","confirmed_by":"provider","confirmed_at":"2026-07-05","items":[{"field_path":"schedule.application-deadline","source_clauses":["clause-1"],"state":"confirmed","note":"Fixture schedule confirmed."},{"field_path":"eligibility.rules.rule-1","source_clauses":["clause-1"],"state":"confirmed","note":"Direct status edit fixture omits predicate_state."},{"field_path":"funding.base_award","source_clauses":["clause-1"],"state":"confirmed","note":"Fixture funding confirmed."},{"field_path":"deliverables.deliverable-1","source_clauses":["clause-1"],"state":"confirmed","note":"Fixture deliverable confirmed."}]}
