{"spec_path":"tools/fixtures/spec/gate-predicate-mismatch.json","spec_version":1,"spec_sha256":null,"confirmed_by":"applicant","confirmed_at":null,"items":[{"field_path":"schedule.application-deadline","source_clauses":["clause-1"],"state":"confirmed","note":"Gate fixture schedule item confirmed."},{"field_path":"eligibility.rules.rule-1","source_clauses":["clause-1"],"state":"confirmed","note":"Gate fixture mandatory rule encoded.","predicate_state":"encoded"},{"field_path":"eligibility.rules.rule-2","source_clauses":["clause-1"],"state":"confirmed","note":"Gate fixture wrongly marks a null predicate as encoded.","predicate_state":"encoded"},{"field_path":"funding.base_award","source_clauses":["clause-1"],"state":"confirmed","note":"Gate fixture funding confirmed."},{"field_path":"deliverables.deliverable-1","source_clauses":["clause-1"],"state":"confirmed","note":"Gate fixture deliverable confirmed."}]}
