{"spec_path":"tools/fixtures/spec/bonus-missing.json","spec_version":1,"spec_sha256":null,"confirmed_by":null,"confirmed_at":null,"items":[{"field_path":"schedule.application-deadline","source_clauses":["clause-1"],"state":"confirmed","note":"Fixture schedule confirmed."},{"field_path":"eligibility.rules.rule-1","source_clauses":["clause-1"],"state":"confirmed","note":"Fixture scoring rule confirmed."},{"field_path":"funding.base_award","source_clauses":["clause-1"],"state":"confirmed","note":"Fixture funding confirmed."},{"field_path":"deliverables.deliverable-1","source_clauses":["clause-1"],"state":"confirmed","note":"Fixture deliverable confirmed."}]}
