{"spec_path":"tools/fixtures/spec/coverage-missing-draft.json","spec_version":1,"spec_sha256":null,"confirmed_by":"applicant","confirmed_at":null,"items":[{"field_path":"schedule.application-deadline","source_clauses":["clause-1"],"state":"confirmed","note":"Coverage fixture schedule item confirmed."},{"field_path":"eligibility.rules.rule-1","source_clauses":["clause-1"],"state":"confirmed","note":"Coverage fixture mandatory rule encoded.","predicate_state":"encoded"},{"field_path":"eligibility.rules.rule-2","source_clauses":["clause-1"],"state":"confirmed","note":"Coverage fixture exclude rule is not encodable.","predicate_state":"not_encodable"},{"field_path":"funding.base_award","source_clauses":["clause-1"],"state":"confirmed","note":"Coverage fixture funding confirmed."}]}
