{
  "spec_path": "tools/fixtures/spec/provider-null-portal-url.json",
  "spec_version": 1,
  "spec_sha256": "c70394209ce7b377d91a69b9805c761bbeef3234b5747f47e937bd9ca7db3868",
  "confirmed_by": "provider",
  "confirmed_at": "2026-07-17T12:00:00+09:00",
  "items": [
    {
      "field_path": "schedule.application-deadline",
      "state": "confirmed",
      "source_clauses": ["clause-1"],
      "note": "Fixture confirmation.",
      "confirmed_at": "2026-07-17"
    },
    {
      "field_path": "eligibility.rules.rule-1",
      "state": "confirmed",
      "source_clauses": ["clause-1"],
      "note": "Fixture confirmation.",
      "predicate_state": "not_encodable",
      "confirmed_at": "2026-07-17"
    },
    {
      "field_path": "funding.base_award",
      "state": "confirmed",
      "source_clauses": ["clause-1"],
      "note": "Fixture confirmation.",
      "confirmed_at": "2026-07-17"
    },
    {
      "field_path": "deliverables.deliverable-1",
      "state": "confirmed",
      "source_clauses": ["clause-1"],
      "note": "Fixture confirmation.",
      "confirmed_at": "2026-07-17"
    }
  ]
}
