{"spec_path":"tools/fixtures/spec/gate-predicate-pending.json","spec_version":1,"spec_sha256":null,"confirmed_by":"applicant","confirmed_at":null,"items":[{"field_path":"schedule.application-deadline","source_clauses":["clause-1"],"state":"confirmed","note":"Gate fixture schedule item confirmed."},{"field_path":"eligibility.rules.rule-1","source_clauses":["clause-1"],"state":"confirmed","note":"Gate fixture leaves predicate_state pending.","predicate_state":"pending"},{"field_path":"eligibility.rules.rule-2","source_clauses":["clause-1"],"state":"confirmed","note":"Gate fixture exclude rule is not encodable.","predicate_state":"not_encodable"},{"field_path":"funding.base_award","source_clauses":["clause-1"],"state":"confirmed","note":"Gate fixture funding confirmed."},{"field_path":"deliverables.deliverable-1","source_clauses":["clause-1"],"state":"confirmed","note":"Gate fixture deliverable confirmed."}]}
